c_TipoRelacion,Descripción,Fecha inicio de vigencia,Fecha fin de vigencia,entry_status,create_date,create_by,update_date,update_by
1,Nota de crédito de los documentos relacionados,2023-01-01 00:00:00,2025-01-01 00:00:00,0,2023-01-01 00:00:00,2309150001,2023-01-01 00:00:00,2309150001
2,Nota de débito de los documentos relacionados,2023-01-01 00:00:00,2025-01-01 00:00:00,0,2023-01-01 00:00:00,2309150001,2023-01-01 00:00:00,2309150001
3,Devolución de mercancía sobre facturas o traslados previos,2023-01-01 00:00:00,2025-01-01 00:00:00,0,2023-01-01 00:00:00,2309150001,2023-01-01 00:00:00,2309150001
4,Sustitución de los CFDI previos,2023-01-01 00:00:00,2025-01-01 00:00:00,0,2023-01-01 00:00:00,2309150001,2023-01-01 00:00:00,2309150001
5,Traslados de mercancías facturados previamente,2023-01-01 00:00:00,2025-01-01 00:00:00,0,2023-01-01 00:00:00,2309150001,2023-01-01 00:00:00,2309150001
6,Factura generada por los traslados previos,2023-01-01 00:00:00,2025-01-01 00:00:00,0,2023-01-01 00:00:00,2309150001,2023-01-01 00:00:00,2309150001
7,CFDI por aplicación de anticipo,2023-01-01 00:00:00,2025-01-01 00:00:00,0,2023-01-01 00:00:00,2309150001,2023-01-01 00:00:00,2309150001
